Author  Notes,Format,Title,title_href,Year,Cause
Events 2000 years after the disaster of 1994,Television,Thundarr the Barbarian,/wiki/Thundarr_the_Barbarian,19801982,Impact Event
Game from Timeline Ltd,Game,The Morrow Project,/wiki/The_Morrow_Project,19801983,War
,Film,Mad Max 2 The Road Warrior10,"/wiki/Mad_Max_2:_The_Road_Warrior,#cite_note-ReferenceA-10",1981,War
Film version directed by Christian de Chalonge Starring Michel Serrault Jacques Dutronc and JeanLouis Trintignant,Film,Malevil,/wiki/Malevil,1981,War
Jerry Ahern  Series First book 1981 Total War,Novel,The Survivalist,/wiki/The_Survivalist,1981,War
Game from Fantasy Games Unlimited,Game,Aftermath,/wiki/Aftermath!,1981,War
Series of seven books by Paul O Williams  first book 1981 The Breaking of Northwall A thousand years after a series of nuclear exchanges Republished in 2005,Novel,The Pelbar Cycle,/w/index.php?title=The_Pelbar_Cycle&action=edit&redlink=1,1981,War
Craig Harrison  Adapted into the 1985 movie of the same name,Novel,The Quiet Earth,/wiki/The_Quiet_Earth,1981,Eco
1981 adaptation of The Day of the Triffids by John Wyndham,Television,The Day of the Triffids 1981 TV series,/wiki/The_Day_of_the_Triffids_(1981_TV_series),1981,Social collapse
Nicholas Fisk,Novel,Robot Revolt,/w/index.php?title=Robot_Revolt&action=edit&redlink=1,1981,Technology
Story arc Days of Future Past by Chris Claremont  John Byrne,Novel,Uncanny XMen,/wiki/Uncanny_X-Men,1981,Technology
Postapocalyptic Italian film6667,Film,2020 Texas Gladiators13,"/w/index.php?title=2020_Texas_Gladiators&action=edit&redlink=1,#cite_note-books.google.co.uk-13",1982,War
Returning astronauts encounter bikers and mutants in a postnuclear setting Released as Zombie Aftermath in the UK68,Film,The Aftermath13,"/wiki/The_Aftermath_(film),#cite_note-books.google.co.uk-13",1982,War
Cyberpunk manga series by Katsuhiro Otomo published by Dark Horse Comics  about a group of young bikers in a postapocalyptic Tokyo who clash with the government and psychics with incredible power Adapted into a 1988 animated movie,Comic,Akira,/wiki/Akira_(manga),19821990,War
,Film,Human Highwaycitation needed,"/wiki/Human_Highway,/wiki/Wikipedia:Citation_needed",1982,War
A lowbudget Bmovie  an extremely loose adaptation of the novel She by H Rider Haggard starring Sandahl Bergman as a postcivilization warrior,Film,She69,"/wiki/She_(1982_film),#cite_note-69",1982,War
,Film,Warriors of the Wasteland13,"/wiki/Warriors_of_the_Wasteland_(film),#cite_note-books.google.co.uk-13",1982,War
,Television,Whoops Apocalypse,/wiki/Whoops_Apocalypse,1982,War
Frank Herbert,Novel,The White Plague,/wiki/The_White_Plague,1982,Disease
Created by Williams,Game,Robotron 2084,/wiki/Robotron:_2084,1982,Technology
The anime series and its sequels rewritten and combined with The Super Dimension Cavalry Southern Cross and Genesis Climber Mospeada to create Robotech which dealt similarly with postapocalyptic themes,Television,The Super Dimension Fortress Macross,/wiki/The_Super_Dimension_Fortress_Macross,19821983,Aliens
An Italian film set in 2019 featuring a mercenary out to rescue the last fertile woman on Earth,Film,2019 After the Fall of New York13,"/wiki/2019,_After_the_Fall_of_New_York,#cite_note-books.google.co.uk-13",1983,War
70,Film,Endgame13,"/wiki/Endgame_(1983_film),#cite_note-books.google.co.uk-13",1983,War
717273,Film,Exterminators of the Year 3000citation needed,"/w/index.php?title=Exterminators_of_the_Year_3000&action=edit&redlink=1,/wiki/Wikipedia:Citation_needed",1983,War
Luc Besson,Film,Le Dernier Combat74,"/wiki/Le_Dernier_Combat,#cite_note-74",1983,War
7576,Film,Stryker13,"/w/index.php?title=Stryker_(1983_film)&action=edit&redlink=1,#cite_note-books.google.co.uk-13",1983,War
,Film,Testament24,"/wiki/Testament_(film),#cite_note-ReferenceC-24",1983,War
Wanderer of a supersonic motorcycle becomes the saviour of misfits vs the Omegas,Film,Warrior of the Lost World13,"/wiki/Warrior_of_the_Lost_World,#cite_note-books.google.co.uk-13",1983,War
77,Film,Yor the Hunter from the Future,"/wiki/Yor,_the_Hunter_from_the_Future",1983,War
The effects of nuclear war on a Kansas town,Television,The Day After,/wiki/The_Day_After,1983,War
Patrick Tilley  series set at the end of the 3rd millennium,Novel,The Amtrak Wars,/wiki/The_Amtrak_Wars,1983,War
Series by William W Johnstone  first book 1983 Out of the Ashes,Novel,The Ashes78,"/wiki/William_W._Johnstone#The_Ashes_series,#cite_note-78",1983,War
Influential shonen manga series by Buronson and Tetsuo Hara  A warrior trained in a powerful martial arts style rights wrongs and battles evil warlords in a postapocalyptic world Inspired the landmark anime series a liveaction film and many games,Comic,Fist of the North Star,/wiki/Fist_of_the_North_Star,19831988,War
Sterling E Lanier  sequel is The Unforsaken Hiero 1985 A metis priestkillman quests across postapocalyptic northeastern North America seven thousand years in the future,Novel,Hieros Journey,/w/index.php?title=Hiero%27s_Journey&action=edit&redlink=1,1983,War
Gudrun Pausewang  Die Letzten Kinder Von Schewenborn in German,Novel,The Last Children of Schewenborn,/wiki/The_Last_Children_of_Schewenborn,1983,War
Dean Ing,Novel,Pulling Through,/w/index.php?title=Pulling_Through&action=edit&redlink=1,1983,War
William Prochnau,Novel,Trinitys Child,/wiki/Trinity%27s_Child,1983,War
Series by Hideyuki Kikuchi  first book 1983 Novels and later anime movies set ten thousand years after a nuclear war occurs in 1999,Novel,Vampire Hunter D,/wiki/Vampire_Hunter_D,1983,War
The anime series see also Robotech,Television,Genesis Climber Mospeada,/wiki/Genesis_Climber_Mospeada,19831984,Aliens
The television series,Television,V,/wiki/V_(science_fiction),19831985,Aliens
79,Film,Dark Enemycitation needed,"/w/index.php?title=Dark_Enemy&action=edit&redlink=1,/wiki/Wikipedia:Citation_needed",1984,War
In the Cell saga of Dragon Ball Z a time traveler arrives from a postapocalyptic future where two powerful killer androids have destroyed much of the world and attempts to stop the same thing from happening in the main timeline,Comic,Dragon Ball,/wiki/Dragon_Ball,19841995,Technology
After an atomic war Phillip Hammer and Marlowe Chandler have spent 15 years on their own in a bunker then they find the keys to the last MX missile8182,Film,Radioactive Dreams80,"/wiki/Radioactive_Dreams,#cite_note-80",1984,War
A Polish comedy,Film,Sexmisjacitation needed,"/wiki/Sexmisja,/wiki/Wikipedia:Citation_needed",1984,War
BBC Television Docudrama,Television,Threads,/wiki/Threads,1984,War
BBC adaptation of the 1975 novel of the same name,Television,Z for Zachariah,/wiki/Z_for_Zachariah,1984,War
Robert Swindells,Novel,Brother in the Land,/wiki/Brother_in_the_Land,1984,War
James D Forman,Novel,Doomsday Plus Twelve,/wiki/Doomsday_Plus_Twelve,1984,War
David R Palmer,Novel,Emergence,/wiki/Emergence_(novel),1984,War
D B Drumm  series First book First You Fight,Novel,Traveler,/w/index.php?title=Traveler_(novel_series)&action=edit&redlink=1,1984,War
Whitley Strieber coauthor James Kunetka,Novel,Warday,/wiki/Warday,1984,War
Octavia Butler,Novel,Clays Ark,/w/index.php?title=Clay%27s_Ark&action=edit&redlink=1,1984,Disease
When a comet passes too close to earth two girls are left amid mutants,Film,Night of the Comet,/wiki/Night_of_the_Comet,1984,Impact Event
Hayao Miyazaki  Based on the manga of the same name,Film,Nausica of the Valley of the Wind83,"/wiki/Nausica%C3%A4_of_the_Valley_of_the_Wind_(film),#cite_note-83",1984,Eco
Michael Swanwick  Also an alternate history Story  the 1979 Three Mile Island reactor incident resulted in a very large release of radioactivity devastating the Northeastern US,Novel,In the Drift,/w/index.php?title=In_the_Drift&action=edit&redlink=1,1984,Eco
An adaptation of the first two books in the trilogy by John Christopher,Television,The Tripods,/wiki/The_Tripods#TV_series,19841985,Aliens
Landmark postapocalyptic anime series based on the manga,Television,Fist of the North Star,/wiki/Fist_of_the_North_Star#TV_series,19841987,War
Game from Game Designers Workshop  set in a world where a SinoRussian war degenerates into a limited nuclear conflict that eventually drags in Europe and America,Game,Twilight 2000,/wiki/Twilight:_2000,19841993,War
Series of films dealing with a future devastated by a war between humans and machines the attempt of the machines to kill the hero of the human resistance in the past and the attempt of the hero and others to prevent this future from ever coming to pass,Film,Terminator,/wiki/Terminator_(franchise),19842009,Technology
,Film,DefCon 413,"/wiki/Def-Con_4,#cite_note-books.google.co.uk-13",1985,War
,Film,Mad Max Beyond Thunderdome13,"/wiki/Mad_Max_Beyond_Thunderdome,#cite_note-books.google.co.uk-13",1985,War
After civilization is wiped out by nuclear war an adventurer leads a group of wanderers on a search for the fabled Mountain of Life,Film,Warriors of the Apocalypse13,"/wiki/Warriors_of_the_Apocalypse,#cite_note-books.google.co.uk-13",1985,War
Louise Lawrence,Novel,Children of the Dust,/wiki/Children_of_the_Dust_(novel),1985,War
Denis Johnson,Novel,Fiskadoro,/w/index.php?title=Fiskadoro&action=edit&redlink=1,1985,War
Ian Livingstone  part of the Fighting Fantasy Gamebook series Like a Choose Your Own Adventure book,Novel,Freeway Fighter,/wiki/Freeway_Fighter,1985,War
David Brin  the 1997 movie of the same name,Novel,The Postman,/wiki/The_Postman,1985,War
Christopher Anvil,Novel,The Steel the Mist and the Blazing Sun,"/w/index.php?title=The_Steel,_the_Mist_and_the_Blazing_Sun&action=edit&redlink=1",1985,War
James Morrow,Novel,This is the Way the World Ends,/wiki/This_is_the_Way_the_World_Ends,1985,War
84,Film,City Limits,/wiki/City_Limits_(1985_film),1985,Disease
Greg Bear,Novel,Blood Music,/wiki/Blood_Music_(novel),1985,Disease
Alan E Nourse  Follows the progression of a new outbreak of Black Plague and the struggle to survive as society collapses,Novel,The Fourth Horseman,,1985,Disease
Larry Niven Jerry Pournelle  Baby elephantlike invaders hurl asteroids at earth humans revolt,Novel,Footfall,/wiki/Footfall,1985,Aliens
Margaret Atwood  Dystopia is fueled by rampant infertility caused by pollution,Novel,The Handmaids Tale,/wiki/The_Handmaid%27s_Tale,1985,Eco
,Film,Starchaser The Legend of Orin,/wiki/Starchaser:_The_Legend_of_Orin,1985,Technology
Thomas J Ryan,Novel,The Adolescence of P1,/wiki/The_Adolescence_of_P-1,1985,Technology
GamebookAnd its source books supplements and sequels was the first roleplaying game from Palladium Books conceived and written by Kevin Siembieda,Game,The Mechanoid Invasion,/wiki/The_Mechanoid_Invasion,1985,Technology
Based on the 1981 novel The Quiet Earth by Craig Harrison,Film,The Quiet Earth,/wiki/The_Quiet_Earth_(film),1985,Sun
In Colorado 900 years after a nuclear war in the USA humanity is back to the stone ages86,Film,America 300085,"/wiki/America_3000,#cite_note-85",1986,War
Animated Japanese film,Film,Fist of the North Starcitation needed,"/wiki/Fist_of_the_North_Star_(1986_film),/wiki/Wikipedia:Citation_needed",1986,War
,Film,Robot Holocaust13,"/wiki/Robot_Holocaust,#cite_note-books.google.co.uk-13",1986,War
,Film,The Sacrifice87,"/wiki/The_Sacrifice,#cite_note-HttpbooksgooglecoukbooksidVXkqzmaBICpgPAdqTheSacrifice-87",1986,War
Jimmy Murakami  adapting the graphic novel by Raymond Briggs,Film,When the Wind Blows,/wiki/When_the_Wind_Blows_(1986_film),1986,War
,Film,Whoops Apocalypse,/wiki/Whoops_Apocalypse#Movie,1986,War
James Axler  Novel series,Novel,Deathlands,/wiki/Deathlands,1986,War
Series by David L Robbins  first book 1986,Novel,Endworld,/wiki/Endworld,1986,War
Konstantin Lopushanskij,Film,Dead Mans Letters,/wiki/Dead_Man%27s_Letters,1986,Disease
Stephen King  Aliens remotely control machines trucks cars and even vending machines to kill the human population before invading Based on the Stephen King short story Trucks,Story,Maximum Overdrive,/wiki/Maximum_Overdrive,1986,Aliens
Also known as Solarwarriors,Film,Solarbabies,/wiki/Solarbabies,1986,Eco
Whitley Strieber and James Kunetka,Novel,Natures End,/w/index.php?title=Nature%27s_End&action=edit&redlink=1,1986,Eco
Stephen King  1986 short story The End of the Whole Mess a distillate of a Texas aquifer originally harvested and distributed worldwide to reduce human propensity for violencecurses humanity with premature Alzheimers disease and senility,Story,The End of the Whole Mess,/wiki/The_End_of_the_Whole_Mess,1986,Eco
Johji Manabe  manga,Comic,Outlanders,/wiki/Outlanders_(manga),19861989,Aliens
,Film,Cherry 2000citation needed,"/wiki/Cherry_2000,/wiki/Wikipedia:Citation_needed",1987,War
,Film,Creepozoids88,"/wiki/Creepozoids,#cite_note-88",1987,War
,Film,Death Runcitation needed,"/wiki/Death_Run,/wiki/Wikipedia:Citation_needed",1987,War
,Film,Hell Comes to Frogtowncitation needed,"/wiki/Hell_Comes_to_Frogtown,/wiki/Wikipedia:Citation_needed",1987,War
90,Film,Steel Dawn89,"/wiki/Steel_Dawn,#cite_note-89",1987,War
The Soviet Union blames the US for a nuclear explosion and in the ensuing chaos the protagonist must defend his family Based on the Jerry Ahern pulp novel series91,Film,The Survivalist,,1987,War
92,Film,Survivor,/w/index.php?title=Survivor_(1987_film)&action=edit&redlink=1,1987,War
Three technicians working in an underground laboratory discover that a nuclear war has destroyed most of the above ground world,Film,Urban Warriors,,1987,War
,Television,Knights of God,/wiki/Knights_of_God,1987,War
Series by Scott Siegel  first book 1987 coauthor Barbera Siegel Grade 810,Novel,Fire Brats,/wiki/Fire_Brats,1987,War
Series by Isobelle Carmody  first book 1987,Novel,Obernewtyn Chronicles,/wiki/Obernewtyn_Chronicles,1987,War
Robert R McCammon,Novel,Swan Song,/wiki/Swan_Song_(novel),1987,War
Game from SNK,Game,Crystalis,/wiki/Crystalis,1987,War
Greg Bear,Novel,The Forge of God,/wiki/The_Forge_of_God,1987,Aliens
David Gemmell  The world is devastated by huge tsunamis Most of the technology left in the world is on par with the mid to late 1800s but there are some newer weapons around,Novel,Wolf In Shadow,/wiki/Wolf_in_Shadow_(novel),1987,Eco
Helloween,Song,Twilight of The Gods,/wiki/Keeper_of_the_Seven_Keys_Part_1,1987,Technology
Paul Auster,Novel,In the Country of Last Things,/wiki/In_the_Country_of_Last_Things,1987,Unspecified
After a war against the machines in which the humans lost a small group of resistance fighters must keep humanity alive against the evil forces of Lord Dread,Television,Captain Power and the Soldiers of the Future,/wiki/Captain_Power_and_the_Soldiers_of_the_Future,19871988,Technology
Groundbreaking anime movie based on the manga of the same name,Film,Akira,/wiki/Akira_(film),1988,War
,Film,Miracle Milecitation needed,"/wiki/Miracle_Mile_(film),/wiki/Wikipedia:Citation_needed",1988,War
,Film,SheWolves of the Wastelandcitation needed,"/wiki/She-Wolves_of_the_Wasteland,/wiki/Wikipedia:Citation_needed",1988,War
9394,Film,World Gone Wild,/wiki/World_Gone_Wild,1988,War
Series by Joe Dever  first book 1988,Novel,Freeway Warrior,/wiki/Freeway_Warrior,1988,War
Sheri S Tepper,Novel,The Gate to Womens Country,/wiki/The_Gate_to_Women%27s_Country,1988,War
William Brinkley,Novel,The Last Ship,/wiki/The_Last_Ship,1988,War
Mitch Berman,Novel,Time Capsule95,"/w/index.php?title=Time_Capsule_(novel)&action=edit&redlink=1,#cite_note-95",1988,War
Part science fiction thriller and part black comedy,Film,They Live,/wiki/They_Live,1988,Aliens
The computer game,Game,Manhunter,/wiki/Manhunter_(game),1988,Aliens
PCPostApocalyptic RPG main story features a rogue AI that not only caused a nuclear war between the United States and Soviet Union but also is attempting to eradicate any humans that survived,Game,Wasteland,/wiki/Wasteland_(video_game),1988,Technology
Robert Silverberg,Novel,At Winters End,/w/index.php?title=At_Winter%27s_End&action=edit&redlink=1,1988,Human Decline
Miniature wargamingMiniature wargame by Games Workshop  A roleplaying game franchise composed of the game and associated novels and shortstory anthologies set within the Dark Future universe,Game,Dark Future,/wiki/Dark_Future,1988,Social Collapse
Pat Cadigan  A novel set in a cyberpunk world following a vaguely described natural cataclysm,Novel,Tea from an Empty Cup,/wiki/Tea_from_an_Empty_Cup,1988,Unspecified
The second season of this television spinoff from the 1953 movie was set after a successful alien invasion,Television,War of the Worlds The Second Invasion,/wiki/War_of_the_Worlds_(TV_series),19881990,Aliens
Australian film written and directed by David Webb Peoples,Film,The Blood of Heroes13,"/wiki/The_Blood_of_Heroes,#cite_note-books.google.co.uk-13",1989,War
,Film,Cyborg96,"/wiki/Cyborg_(film),#cite_note-96",1989,War
,Film,Empire of Ash IIcitation needed,"/wiki/Empire_of_Ash_II,/wiki/Wikipedia:Citation_needed",1989,War
,Film,Empire of Ash IIIcitation needed,"/wiki/Empire_of_Ash_III,/wiki/Wikipedia:Citation_needed",1989,War
Orson Scott Card  novella West plus several short stories,Novel,Folk of the Fringe,/w/index.php?title=Folk_of_the_Fringe&action=edit&redlink=1,1989,War
Game by Atari Games,Game,Badlands,/wiki/Badlands_(video_game),1989,War
Jean Ure  Sequels Come Lucky April and Watchers at the Shrine,Novel,Plague 99,/wiki/Plague_99,1989,Disease
,Film,Millennium,/wiki/Millennium_(film),1989,Eco
,Film,Slipstream,/wiki/Slipstream_(1989_film),1989,Eco
Ben Elton,Novel,Stark,/wiki/Stark_(novel),1989,Eco
,Film,Gunhed,/wiki/Gunhed_(film),1989,Technology
,Film,Moontrap,/wiki/Moontrap,1989,Technology
Al Sarrantonio  About a worldwide uprising of werewolves,Novel,Moonbane,/w/index.php?title=Moonbane&action=edit&redlink=1,1989,Monsters
Mark E Rogers  Combines themes of the rapture and zombies,Novel,The Dead,,1989,Supernatural
,Film,The Handmaids Tale97,"/wiki/The_Handmaid%27s_Tale_(film),#cite_note-97",1990,War
,Film,Hardware13,"/wiki/Hardware_(film),#cite_note-books.google.co.uk-13",1990,War
,Film,Robot Jox,/wiki/Robot_Jox,1990,War
Australian childrens drama in which a girl from the 31st century after the Northern Hemisphere has been destroyed in the Great Disaster later revealed to be a nuclear holocaust becomes stranded in the 20th century In the sequel Tomorrows End 1993 she and her friends fight to prevent history from being changed in such a way that the Southern Hemisphere is destroyed as well,Television,The Girl from Tomorrow,/wiki/The_Girl_from_Tomorrow,1990,War
Isaac Asimov Robert Silverberg extension written by Silverberg of the Asimov story of the same name,Novel,Nightfall,/wiki/Nightfall_(Asimov),1990,War
Game,Game,Mad Max,/wiki/Mad_Max_(1990_video_game),1990,War
A nuclear exchange triggers the return of Ley Lines and Interdimensional Rifts or portals These Ley Lines and Portals subsequently cause several natural and supernatural disasters,Game,Rifts,/wiki/Rifts_(role-playing_game),1990,War
A mysterious plague has swept over the entire world causing everyone to suffer from amnesia leading to the collapse of civilization Based on a novel by Hideyuki Kikuchi,Film,A Wind Named Amnesia,/wiki/A_Wind_Named_Amnesia,1990,Disease
ITV show about 3 people who lived after everyone else in England was turned to dust by a chemical that was accidentally released by a television presenter,Television,Not with a Bang,/wiki/Not_with_a_Bang,1990,Disease
Pat Murphy  In the wake of a devastating worldwide plague a handful of artists transform the City of San Francisco and fend off marauders with a touch of magic,Novel,The City Not Long After,"/wiki/The_City,_Not_Long_After",1990,Disease
M K Wren,Novel,A Gift Upon the Shore,/wiki/A_Gift_Upon_the_Shore,1990,Disease
Also known as Dark Angel directed by Craig R Baxley,Film,I Come in Peace,/wiki/I_Come_in_Peace,1990,Aliens
Celia S Friedman,Novel,The Madness Season,/w/index.php?title=The_Madness_Season&action=edit&redlink=1,1990,Aliens
Taking place in the year 2037 the loss of the ozone layer has left most of the planet a desolate wasteland scattered with highly radioactive Death Zones,Film,Mindwarp,/wiki/Mindwarp_(film),1990,Eco
After an environmental holocaust a lone cop battles a gang of rampaging marauders,Film,Omega Cop,/wiki/Omega_Cop,1990,Eco
Gordon R Dickson  A man and a wolf band together to survive in an America devastated by financial collapse,Novel,Wolf and Iron,,1990,Social Collapse
,Television,Bucky OHare,/wiki/Bucky_O%27Hare,19901991,Technology
Environment disaster The Captain Planet twoparter Two Futures in which the character Wheeler gets a glimpse of what could happen if damage to the environment was allowed to continue unchecked,Television,Captain Planet,/wiki/Captain_Planet,19901992,Eco
Donald E McQuinn  trilogy Warrior Wanderer  Witch set in the Pacific Northwest generations after World War III,Novel,Gan Moondark,/w/index.php?title=Gan_Moondark&action=edit&redlink=1,19901994,War
JeanPierre Jeunet and Marc Caro,Film,Delicatessen98,"/wiki/Delicatessen_(film),#cite_note-98",1991,War
Wang Lixiong  in the Chinese under the pseudonym Bao Mi about a nuclear civil war in the Peoples Republic of China,Novel,Yellow Peril,/wiki/Yellow_Peril_(novel),1991,War
Game from Psygnosis,Game,ArmourGeddon,/wiki/Armour-Geddon,1991,War
Larry Niven Jerry Pournelle and Michael Flynn  Spacebased civilization exists despite the governments wishes during an ice age,Novel,Fallen Angels,/wiki/Fallen_Angels_(science_fiction_novel),1991,Eco
A Dungeons and Dragons campaign setting by TSR Inc  focusing on a world that has been turned into an inhospitable desert by overuse of magic that destroyed the surrounding vegetation,Game,Dark Sun,/wiki/Dark_Sun,1991,Eco
,Film,The Rapture,/wiki/The_Rapture_(film),1991,Supernatural
Shortlived sitcom about the survivors of a nuclear war,Television,woops,/wiki/Woops!,1992,War
Game Mad Max inspired driving game from 199293 for Snes and Genesis,Game,Outlander,/wiki/Outlander_(video_game),1992,War
P D James,Novel,The Children of Men,/wiki/The_Children_of_Men,1992,Disease
,Film,American Cyborg Steel Warrior,/wiki/American_Cyborg:_Steel_Warrior,1992,Technology
Al Sarrantonio  The galaxy passes through a cloud in space which causes all previously expired creatures on Earth to return to life as bloodthirsty skeletons shrouded in ghostly mirages of their former selves,Novel,Skeletons,/w/index.php?title=Skeletons_(novel)&action=edit&redlink=1,1992,Monsters
,Film,Cyborg 2citation needed,"/wiki/Cyborg_2,/wiki/Wikipedia:Citation_needed",1993,War
Sequel to Robot Jox,Film,Robot Warscitation needed,"/wiki/Robot_Wars_(film),/wiki/Wikipedia:Citation_needed",1993,War
Connie Willis,Novel,Doomsday Book,/wiki/Doomsday_Book_(novel),1993,Disease
Another film based on the novel The Body Snatchers by Jack Finney,Film,Body Snatchers,/wiki/Body_Snatchers_(1993_film),1993,Aliens
The computer game,Game,XCOM UFO Defense and subsequent followups,"/wiki/X-COM:_UFO_Defense,/wiki/X-COM_(series)#The_series",1993,Aliens
Octavia E Butler,Novel,Parable of the Sower,/wiki/Parable_of_the_Sower_(novel),1993,
One mans quest for revenge in a world where toxic waste has driven the remains of civilization into the Arctic Circle,Film,The Last Border  Viimeisell Rajalla,http://www.imdb.com/title/tt0107364/,1993,Eco
Starhawk,Novel,The Fifth Sacred Thing,/wiki/The_Fifth_Sacred_Thing,1993,Eco
Norman Spinrad  The results of global warming,Novel,Deus X,/w/index.php?title=Deus_X&action=edit&redlink=1,1993,Eco
Ben Elton  The Earths population is forced to live in Biodomes for 50 years while the environment recovers from humanitys actions,Novel,This Other Eden,/wiki/This_Other_Eden_(novel),1993,Eco
Takes place long after a time of environmental collapse that destroyed the worlds older advanced civilizations,Game,Secret of Mana,/wiki/Secret_of_Mana,1993,Eco
Warwick Collins,Novel,Computer One,/wiki/Computer_One,1993,Technology
Roger Williams,Novel,The Metamorphosis of Prime Intellect,/wiki/The_Metamorphosis_of_Prime_Intellect,1993,Technology
Multia Japanese scrolling shooter arcade game,Game,RayForce,/wiki/RayForce,1993,Technology
Animated TV series In which dinosaurs reclaim the earth Based upon the comic series Xenozoic Tales,Television,Cadillacs and Dinosaurs,/wiki/Cadillacs_and_Dinosaurs_(TV_series),1993,Monsters
A video game series created by Capcom,Game,Mega Man X series,/wiki/Mega_Man_X_series,1993present,Technology
A computer game series created by id Software  about a demonic invasion of human colonies on the moons of Mars The sequel to the original game Doom II Hell on Earth sees the demons invading Earth itself,Game,Doom series,/wiki/Doom_(video_game),1993present,Supernatural
Made for TV movie that was designed to be a pilot for a post Apocalyptic spinoff from the original Knight Rider,Television,Knight Rider 2010,/wiki/Knight_Rider_2010,1994,War
miniseries,Television,The Stand,/wiki/Stephen_King%27s_The_Stand,1994,Disease
,Television,Highlander The Animated Series,/wiki/Highlander:_The_Animated_Series,1994,Impact Event
Super Nintendo A game were a comet passes next to Earth which is a malicious being whose light turns humans into monsters The story takes place in an altered reality where to approaching comet already changed timeline and reality,Game,Illusion of Gaia,/wiki/Illusion_of_Gaia,1994,Impact Event
console Named Final Fantasy III during initial American launch of the game features a plot twist in where villain Kefka moves magical statues out of their intended alignment which in turn causes the balanced fictional world to fall into ruin and for Kefka to become its new god while protected by the powers of the same statues,Game,Final Fantasy VI,/wiki/Final_Fantasy_VI,1994,Eco
And sequels from Sierra Entertainment,Game,Earthsiege,/wiki/Metaltech:_Earthsiege,1994,Technology
MultiDeveloped by Mirage Studios A fighting game,Game,Rise of the Robots,/wiki/Rise_of_the_Robots,1994,Technology
