Author  Notes,Format,Title,title_href,Year,Cause
Tornado disaster The 2004 television movie Category 6 Day of Destruction where Chicago is suffering from a series of tornadoes from numerous changes occurring in the climate This series was followed in 2005 by Category 7 The End of the World,Television,Category 6 Day of Destruction,/wiki/Category_6:_Day_of_Destruction,2004,Eco
Earthquake disaster The 2004 mini series 105 and its 2006 followup 105 Apocalypse In which a series of Earthquakes tears America apart separating the West Coast from the rest of the USA,Television,105,/wiki/10.5_(TV_miniseries),2004,Eco
PC A German 3D RPG situated in a post apocalyptic future where humanity is facing its possible endThe focus of the game is the deep story and the unique characters with living environment offering many well thought sidequests Gameplay similar to the Fallout series although with a more traditional RPG approach in which the player can assemble a whole party in order to improve chances in battles and include specialists with complementary skills,Game,The Fall Last Days of Gaia,/wiki/The_Fall:_Last_Days_of_Gaia,2004,Eco
,Film,Sky Captain and the World of Tomorrow,/wiki/Sky_Captain_and_the_World_of_Tomorrow,2004,Technology
Part of the Dune universe by Kevin J Anderson,Novel,The Battle of Corrin,/wiki/The_Battle_of_Corrin,2004,Technology
A manga series created by Takuya Fujima,Comic,Deus Vitae,/wiki/Deus_Vitae,2004,Technology
,Television,Zentrix,/wiki/Zentrix,2004,Technology
A roleplaying game set in the midst of a war between humans and a worldwide computer intelligence,Game,Splicers,/wiki/Splicers,2004,Technology
MultiIs a Japanese postapocalyptic visual novel and video game,Game,Planetarian Chiisana Hoshi no Yume,/wiki/Planetarian:_Chiisana_Hoshi_no_Yume,2004,Technology
Takes the premise that with no natural predators to thin the population of the world evolution simply rewards whoever can pass on their genes the fastest who are depicted as sexually promiscuous drunken brutes The average IQ is 80 by 2100 60 by 2200 and 40 by 2505,Film,Idiocracy,,2004,Human Decline
Anime series in future Japan that is a wasteland In the Great Kanto Desert scattered humans eke out a living in the hot sand,Television,Desert Punk,/wiki/Desert_Punk,20042005,War
Scott Westerfeld  Uglies Pretties Specials and the companion novel Extras take place in a future civilization that arose after our current civilization collapsed because of an engineered bacterium that attacked not people but oil changing its chemical composition so that it exploded on contact with oxygen first explained on p345 of Uglies,Novel,The Uglies Trilogy,/wiki/The_Uglies_Trilogy,20042007,Disease
An episode of Masters of Horror directed by Tobe Hooper  It has a triple apocalyptic theme as it features a man made virus causing a zombie outbreak after World War 3,Television,Dance Of The Dead,/wiki/Dance_of_the_Dead_(Masters_of_Horror_episode),2005,War
Sonia Levitin  childrens book,Novel,The Goodness Gene,/w/index.php?title=The_Goodness_Gene&action=edit&redlink=1,2005,War
Series by Dmitry Glukhovsky  Set in the metro tunnels of post apocalyptic Moscow A man named Artyom journeys to the central city of the metro Polis to find answers about a possible threat called the Dark Ones,Novel,Metro 2033,/wiki/Metro_2033_(video_game),2005,War
Based on MTVs animated series on Flux,Film,on Flux,/wiki/%C3%86on_Flux_(film),2005,Disease
Eric Shapiro,Novel,Its Only Temporary,/w/index.php?title=It%27s_Only_Temporary_(book)&action=edit&redlink=1,2005,Impact Event
PCA game in which after a tutorial area set in a preSearing time a race of beasts called the Charr summon meteors down upon the humans destroying nearly all of the cities and all of the life trees animals etc,Game,Guild Wars,/wiki/Guild_Wars,2005,Impact Event
Produced by Sci Fi Channel,Film,Alien Apocalypse,/wiki/Alien_Apocalypse,2005,Aliens
Directed by Steven Spielberg along with the independent 2005 productions HG Wells The War of the Worlds and H G Wells War of the Worlds all based on the H G Wells novel,Film,War of the Worlds,/wiki/War_of_the_Worlds_(2005_film),2005,Aliens
Douglas Niles  Is a retelling of the original The War of the Worlds story but displaces the events to 2005 It is not a sequel rather it is an update,Novel,War of the Worlds New Millennium,/wiki/War_of_the_Worlds:_New_Millennium,2005,Aliens
John Varley,Novel,Eight Worlds,/wiki/Eight_Worlds,2005,Aliens
The 2005 console game in which the player controls a Furon alien in an attempt to overthrow humanity,Game,Destroy All Humans,/wiki/Destroy_All_Humans!,2005,Aliens
The Earths resources and biosphere get used up prompting mass exodus for the stars,Film,Serenity,/wiki/Serenity_(film),2005,Eco
Peter Hyams  A group of travelers returned in the time and made changes in the past which lead to colossal alterations in the future where they came from and less than in a week everything in the world started changing chaotically putting in danger the life of every living thing,Film,A Sound of Thunder,/wiki/A_Sound_of_Thunder_(film),2005,Eco
Abdul Ahad World governments in the 23rd century build and launch a 12mile long generation starship to Alpha Centauri to escape a global Ice Age threatening the future of humanity105,Novel,First Ark to Alpha Centauri,/w/index.php?title=First_Ark_to_Alpha_Centauri&action=edit&redlink=1,2005,Eco
Brian Keene  set in a postapocalyptic world where it started raining one day and never stopped,Story,The Garden Where My Rains Grows,/w/index.php?title=The_Garden_Where_My_Rains_Grows&action=edit&redlink=1,2005,Eco
,Film,9,/wiki/9_(2005_film),2005,Technology
A semisatirical book by Daniel H Wilson,Novel,How to Survive a Robot Uprising,/wiki/How_to_Survive_a_Robot_Uprising,2005,Technology
Sunao Yoshida illustrations by Thores Shibamoto  Light novel involving a war between humans and vampires,Novel,Trinity Blood,/wiki/Trinity_Blood,20012005,Monsters
This anime features several teens living in Hakodate Hokkaido who come in contact with their future selves using time travel as a last resort to end the destruction of their world by abducting their dear friend Haruka Kaminogi from the past as a sacrifice to make the ultimate weapon against the destroyer known as Noein106,Television,Noein,/wiki/Noein,20052006,Future Collapse
Anime series and its video games are set 10000 years after humans had to leave the earth due to a Coralian appearing in Africa In the current timeline the remnants of humanity are now settled on a planet they refer to as the Promised Land,Television,Eureka Seven,/wiki/Eureka_Seven,20052006,Aliens
Environment disaster Anime series where an earthquake triggers a series of worldwide natural disasters that devastate Planet Zi,Television,Zoids Genesis,/wiki/Zoids:_Genesis,20052006,Eco
Comics and books,Comic,Lego ExoForce,/wiki/Lego_Exo-Force,20052007,Technology
Radio sitcom by Graham Duff  much of the world was destroyed by an event known as the Withering,Radio,Nebulous,/wiki/Nebulous,2005present,Eco
The eight years boy Jess has been living in a crumbling underground facility since he was born with eight survivors of an apocalyptic war107,Film,The Dark Hourcitation needed,"/wiki/The_Dark_Hour_(2007_film),/wiki/Wikipedia:Citation_needed",2006,War
CBS  the residents of a small Kansas town remain isolated in the aftermath of a series of nuclear attacks on America,Television,Jericho,/wiki/Jericho_(2006_TV_series),2006,War
Will Self  split between modern London and postapocalyptic London where a new society and religion is based on the legacy of a cab driver,Novel,The Book of Dave,/wiki/The_Book_of_Dave,2006,War
Scott A Johnson,Novel,Deadlands,/wiki/Deadlands,2006,War
Game While seemingly caused by aliens it is in fact human mistakes breakdown and war that forges Auto Assaults apocalyptic world Similar to the Command  Conquer series where an alien event is the catalyst needed to start decline,Game,Auto Assault,/wiki/Auto_Assault,2006,War
British made movie in which a virus creates a plague of zombies viewed entirely from the POV of a characters video camera This film was made and completed before George A Romeros Diary of the Dead which was shot in a similar POV perspective,Film,The Zombie Diaries,/wiki/The_Zombie_Diaries,2006,Zombies
Johnathan Rand and Christopher Knight  A mutated bird flu virus wipes out everyone except the young Set in Michigan,Novel,Pandemia108,"/w/index.php?title=Pandemia_(novel)&action=edit&redlink=1,#cite_note-108",2006,Disease
Max Brooks novel about a global zombie outbreak and humanitys efforts to stop thems,Novel,World War Z,/wiki/World_War_Z,2006,Zombies
Poetry by Brian Henry,Novel,Quarantine,,2006,Disease
,Television,Three Moons Over Milford,/wiki/Three_Moons_Over_Milford,2006,Impact Event
Susan Beth Pfeffer  Asteroid striking the Moon and knocking it into an orbit closer to Earth concentrating on how a family in Western Pennsylvania is affected,Novel,Life as We Knew It,/wiki/Life_as_We_Knew_It_(novel),2006,Impact Event
The video game which takes place on the fictional planet of Sera humans are shown fighting a war against alien monsters that have emerged from underground,Game,Gears of War,/wiki/Gears_of_War,2006,Aliens
A parody of Japan Sinks  All the land on earth sinks into the ocean with Japan being the last to go,Film,The World Sinks Except Japan,/wiki/The_World_Sinks_Except_Japan,2006,Eco
Oisn McGann,Novel,SmallMinded Giants,/w/index.php?title=Small-Minded_Giants&action=edit&redlink=1,2006,Eco
Set after the world population and economy is devastated by simultaneous hyperhurricanes,Television,Innocent Venus,/wiki/Innocent_Venus,2006,Eco
PC firstperson shooting game about a war fought over land unaffected by a new ice age that renders most of the Northern Hemisphere uninhabitable,Game,Battlefield 2142,/wiki/Battlefield_2142,2006,Eco
Anime series by the Japanese production company Manglobe  an undefined global ecological disaster has decimated the surface of the Earth and the small remaining human population lives in isolated citystate dome complexes,Television,Ergo Proxy,/wiki/Ergo_Proxy,2006,Eco
TV movie for Sci Fi Channel,Film,Android Apocalypse,/wiki/Android_Apocalypse,2006,Unspecified
,Television,Lego ExoForce,/wiki/Lego_Exo-Force,2006,Technology
The human race has become infertile Based on the book of the same name,Film,Children of Men87,"/wiki/Children_of_Men,#cite_note-HttpbooksgooglecoukbooksidVXkqzmaBICpgPAdqTheSacrifice-87",2006,Human Decline
Stephen King  A strange cell phone signal turns ordinary humans into killer zombies,Novel,Cell,/wiki/Cell_(novel),2006,Zombies
,Film,The Quick and the Undead,/wiki/The_Quick_and_the_Undead,2006,Zombies
And its 2009 sequel Pulse 2 Afterlife,Film,Pulse,/wiki/Pulse_(2006_film),2006,Supernatural
"James Bai
writerdirector Set in what looks like Brooklyn after the decline the streets are empty and there seems to be constant random killings",Film,Puzzlehead,/wiki/Puzzlehead,2006,Social Collapse
Thomas Glavinic  A novel in which a man wakes up to find that everyone else has disappeared,Novel,Night Work,,2006,Unspecified
Game BoyIn which a small group of humans escape to a postapocalyptic utopia after the old world is destroyed While the game never explains what happened to the old world they say that the humans were the ones that caused its destruction,Game,Mother 3,/wiki/Mother_3,2006,Unspecified
Cormac McCarthy,Novel,The Road,/wiki/The_Road,2006,Unspecified
Episode A Clean Escape,Television,Masters of Science Fiction,/wiki/Masters_of_Science_Fiction,2007,War
Alex Scarrow  sudden end of oil availability leads to worldwide social collapse,Novel,Last Light,,2007,War
Marcus Alexander Hart,Novel,The Oblivion Society,/wiki/The_Oblivion_Society,2007,War
Jim Crace,Novel,The Pesthouse,/w/index.php?title=The_Pesthouse&action=edit&redlink=1,2007,War
Tatyana Tolstaya novel,Novel,The Slynx,/w/index.php?title=The_Slynx&action=edit&redlink=1,2007,War
Ardath Mayhar,Novel,The World Ends in Hickory Hollow,/w/index.php?title=The_World_Ends_in_Hickory_Hollow&action=edit&redlink=1,2007,War
Sequel to 28 Days Later During the efforts to repopulate Britain the discovery of a possible cure to the Rage virus may also begin the apocalypse all over again,Film,28 Weeks Later,/wiki/28_Weeks_Later,2007,Zombies
In an abandoned New York City set in 2012 military virologist Robert Neville tries to find a cure to a manmade virus that killed almost everyone on earth while at the same time trying to survive against the vampiric zombies it left behind,Film,I Am Legend87,"/wiki/I_Am_Legend_(film),#cite_note-HttpbooksgooglecoukbooksidVXkqzmaBICpgPAdqTheSacrifice-87",2007,Disease zombies
,Film,I Am Omega,/wiki/I_Am_Omega,2007,Disease
Written shot and directed by Gareth Edwards,Film,Monsters 2010 film,/wiki/Monsters_(2010_film),2010,Monsters
Autumn on imdb,Film,Autumn,,2009,Disease
Directed by David A Prior,Film,Zombie Wars,,2008,Zombies
Directed by Pearry Teo,Film,The Gene Generation,,2007,Unspecified
The Last Sentinel on imdb,Film,The Last Sentinel,,2007,War
About the conflict between a wealthy couple and a poor laborer after a worldwide terrorist attack isolates them in a small remote ranch,Film,9Tenths,/wiki/9/Tenths,2006,War
Dark comedy directed by Jonny Gillette,Film,The Beach Party at the Threshold of Hell,/wiki/The_Beach_Party_at_the_Threshold_of_Hell,2006,War
Dream Warrior on imdb,Film,Dream Warrior,,2003,Unspecified
,Film,Resident Evil Extinction,/wiki/Resident_Evil:_Extinction,2007,Zombies
Jeff Carlson  Slated to be a trilogy,Novel,Plague Year,/w/index.php?title=Plague_Year&action=edit&redlink=1,2007,Disease
A speculative documentary produced by the Discovery Channel which hypothesizes the effects on modernday earth of a large comet impact,Film,Super Comet After The Impact,/wiki/Super_Comet:_After_The_Impact,2007,Impact Event
Based on the novel The Body Snatchers by Jack Finney A mysterious virus brought by spaceborne microbes possesses humans and renders them devoid of emotion,Film,The Invasion,/wiki/The_Invasion_(film),2007,Aliens
A lowbudget remake of Invasion of the Body Snatchers made by The Asylum to capitalise on the release of The Invasion,Film,Invasion of the Pod People,/wiki/Invasion_of_the_Pod_People,2007,Aliens
A race of both robotic aliens battle for humanity,Film,Transformers,/wiki/Transformers_(film),2007,Aliens
PCMMOGA disastrous solar event in 2019 and 2020 leaves the world devastated with only small pockets of human survivors scratching out a living in a bleak irradiated world Largely fuelled by the stockpiles of hardware left behind by a dead civilization combined with the desperation of a new world order the gladiatorial deathsports begin around 2035 The vast expanses of wilderness between the towns are menaced by gangs of road pirates armed with heavily armed cars and trucks and travelled by equally well armed trade groups making a living by carrying food fuel and other specialist equipment between the towns,Game,Darkwind War on Wheels,/wiki/Darkwind:_War_on_Wheels,2007,Eco
,Film,Meet the Robinsons,/wiki/Meet_the_Robinsons,2007,Technology
A group of survivors called Foragers take cover in an old abandoned hospital where the group attempt to re build society All we know of the apocalypse is that man Ran out of gas but not in the sense of oil just that our time was up,Film,Tooth and Nail,/wiki/Tooth_and_Nail_(film),2007,Human Decline
Animated TV series in which cloned Beastmen fight an apocalyptic battle with humanity,Television,Gurren Lagann,/wiki/Gurren_Lagann,2007,Monsters
Jaume Balaguer and Paco Plaza  Spanish horror film about altered humans by a Demon,Film,REC,/wiki/REC_(film),2007,Zombies
PC XboxSet at the end of a thousand year long war called the infinite war between three separate factions the UEF United Earth Federation the Aeon and the Cybrans,Game,Supreme Commander,/wiki/Supreme_Commander_(game),2007,Future Collapse
Directed by Danny Boyle  The film follows a spaceship crew in the year 2057 who are tasked with reigniting Earths dying sun,Film,Sunshine,/wiki/Sunshine_(2007_film),2007,Sun
PCDemons and humans are in constant struggle on earth,Game,Hellgate London,/wiki/Hellgate:_London,2007,Supernatural
American series about a man living in a postapocalyptic United States after an unspecified cataclysm,Television,Afterworld TV series,/wiki/Afterworld_(TV_series),2007,Unspecified
Adventure game Backstory involves a race of nomadic space traversing humanoids known as Quarians who created a race the Geth of networked artificial intelligences Soon the Geth revolt against the Quarians and forced them into the vastness of space aboard a fleet of star ships without a safe refuge in the galaxy,Game,Mass Effect,/wiki/Mass_Effect_(series),20072011,Technology
Remake of the Neon Genesis Evangelion anime series The first of the four films Evangelion 10 You Are Not Alone debuted in 2007 the second Evangelion 20 You Can Not Advance in 2009 the third Evangelion 30 You Can Not Redo in 2012 The fourth is forthcoming,Film,Rebuild of Evangelion,/wiki/Rebuild_of_Evangelion,2007present,Supernatural
20 years after wars plague and natural disasters a young woman follows the voice of a lone radio broadcaster and delivers the first child born in 15 years109,Film,20 Years After,/wiki/20_Years_After,2008,War
Based on the book by Jeanne Duprau,Film,City of Embercitation needed,"/wiki/City_of_Ember,/wiki/Wikipedia:Citation_needed",2008,War
Based on the Mutant Chronicles RPG,Film,Mutant Chroniclescitation needed,"/wiki/Mutant_Chronicles_(film),/wiki/Wikipedia:Citation_needed",2008,War
Stephen Baxter book about huge underground oceans leaking to the surface lifting sea levels by thousands of metres over several decades,Novel,Flood,/wiki/Flood_(Baxter_novel),2008,War
Young adult series by Suzanne Collins about a survival tournament set in a postapocalyptic continent,Novel,The Hunger Games,/wiki/The_Hunger_Games,2008,War
Harry Turtledove,Novel,The ValleyWestside War,/wiki/The_Valley-Westside_War,2008,War
Game A postapocalyptic roleplaying game from Glutton Creeper Games set after the War on Terror destroy 99 of the worlds population,Game,Exodus roleplaying game,/wiki/Exodus_(role-playing_game),2008,War
,Film,Doomsday87,"/wiki/Doomsday_(film),#cite_note-HttpbooksgooglecoukbooksidVXkqzmaBICpgPAdqTheSacrifice-87",2008,Disease
,Film,Repo The Genetic Opera,/wiki/Repo!_The_Genetic_Opera,2008,Disease
Based upon Mary Shelleys 1826 novel The Last Man,Film,The Last Man,/w/index.php?title=The_Last_Man_(film)&action=edit&redlink=1,2008,Disease
BBC television series a remake of the 70s series of the same name,Television,Survivors,/wiki/Survivors_(2008_TV_Series),2008,Disease
Collapse of global civilization caused by viruslike nanotechnology,Novel,The Martian Generals Daughter,/wiki/The_Martian_General%27s_Daughter,2008,Disease
MultiFeaturing people transformed into crazed zombielike mutants by an infection,Game,Left 4 Dead,/wiki/Left_4_Dead,2008,Zombies
Susan Beth Pfeffer  How the same event as in Life as We Knew It affects a family in New York City,Novel,Dead and the Gone,/wiki/The_Dead_and_the_Gone,2008,Impact Event
Stephenie Meyer  An alien race called Souls take over Earth and its inhabitants The novel follows one Souls predicament when the mind of its human host refuses to cooperate with her takeover,Novel,The Host,/wiki/The_Host_(novel),2008,Aliens
The movie depicts an unknown deadly neurotoxin,Film,The Happening,/wiki/The_Happening_(2008_film),2008,Eco
,Film,Lost City Raiders,/wiki/Lost_City_Raiders,2008,Eco
Earth is abandoned after becoming too polluted to sustain life A robot stays behind and cleans Earth,Film,WALLE,/wiki/WALL-E,2008,Eco
Environment disaster The Doctor Who episode The Poison Sky The poisonous Sontaran gases creating the titular poison sky above Sylvia and Wilfreds street ignite as the flames from the Doctors atmospheric converter spread globally,Television,The Poison Sky,/wiki/The_Poison_Sky,2008,Eco
,Game,Too Human,/wiki/Too_Human,2008,Technology
American remake of the Spanish horror film REC,Film,Quarantine,/wiki/Quarantine_(2008_film),2008,Zombies
A UK television series which chronicles a zombie outbreak,Television,Dead Set,/wiki/Dead_Set_(TV_series),2008,Zombies
Jim Munroe art by Salgood Sam  a postRapture graphic novel,Novel,Therefore Repent,/wiki/Therefore_Repent!,2008,Supernatural
Russell T Davieswriter Explores an apocalyptic alternative future in which British society has collapsed due to the death of Doctor,Television,"Turn Left
Doctor Who episode 197","/wiki/Turn_Left_(Doctor_Who),/wiki/Doctor_Who",2008,Social Collapse
James Kunstler  Explores life in an agrarian village in upstate New York after America collapses under the combined trauma of plague peak oil global warming and nuclear terrorism,Novel,World Made By Hand,/wiki/World_Made_By_Hand,2008,Social Collapse
A TV documentary film and the spinoff Life After People The Series document life on earth after all humans have instantly disappeared The shows does not mention a cause of their disappearance,Film,Life After People,/wiki/Life_After_People,2008,Unspecified
,Television,Terminator The Sarah Connor Chronicles,/wiki/Terminator:_The_Sarah_Connor_Chronicles,20082009,Technology
Astro Boy a robotic reincarnation of his creators lost son lives in highly advanced metro city last of its kind floating above the clouds in the skies of postapocalyptic earth110,Film,Astro Boy,/wiki/Astro_Boy,2009,Eco
A group of 4 on the road trying to find a safe haven while plague rages across the USA,Film,Carriers,/wiki/Carriers_(film),2009,Disease
A virus changes most of the populace into vampires sometime around 2019 At the point where vampirism is considered normal the remaining humans attempt to escape being farmed for their blood while also attempting to find a cure111,Film,Daybreakers,/wiki/Daybreakers,2009,Disease
French ZombieApocalypse film Directed by Benjamin Rocher The film is set in one of French tower blocks wherein a small group of people trying to make their way out of it thrusting through hordes of zombies,Film,La Horde,/wiki/La_Horde,2009,Zombies
Rod Glenn  Five friends struggle to survive 20 years after the collapse of civilisation Set in northern England,Novel,The Killing Moon,/wiki/The_Killing_Moon_(book),2009,Disease
Clemens P Suter  A business man travels home through a deserted postpandemic Eurasia,Novel,Two Journeys,/w/index.php?title=Two_Journeys&action=edit&redlink=1,2009,Disease
MultiFeaturing the same as Left 4 Dead but expanded,Game,Left 4 Dead 2,/wiki/Left_4_Dead_2,2009,Zombies
PCCooperative firstperson shooter video game,Game,Killing Floor,/wiki/Killing_Floor_(2009_video_game),2009,Disease
,Film,2012,/wiki/2012_(film),2009,Eco
Paolo Bacigalupi  In future Thailand where calories are the most needed energy source an unexpected girl struggles to live like as she wants,Novel,The Windup Girl 2009 novel,/wiki/The_Windup_Girl,2009,Eco
Time travel fiction The 2009 ABC Special Earth 2100 explore the future if humans do not take actions to help the ecosystem that can prove to be disastrous Lucy the speaker explains about this world and wonders how she was one of the lucky humans to have survived,Television,Earth 2100,/wiki/Earth_2100,2009,Eco
Adaptation of 2005 years film 9,Film,9,/wiki/9_(2009_film),2009,Technology
The Power Rangers protect the last remnants of humanity who are now settled in the domed city of Corinth after the accidental release of a government created computer virus known as Venjix Malicious and selfaware it leaves most of the planet in nuclear fallout constructs an army of attack bots and begins cybernetic experiments on human prisoners,Television,Power Rangers RPM,/wiki/Power_Rangers:_RPM,2009,Technology
Carrie Ryan  Set generations after the zombie apocalypse a girl struggles against the religious order in her village hoping for life beyond the fences protecting them from the Unconsecrated zombies in the surrounding forest,Novel,The Forest of Hands and Teeth,/wiki/The_Forest_of_Hands_and_Teeth,2009,Zombies
Jaume Balaguer and Paco Plaza  The sequel to 2007s REC,Film,REC 2,/wiki/REC_2,2009,Monsters
Tells of a story where the end of the world caused by a solar flare erupting onto the solar system is accurately predicted,Film,Knowing,/wiki/Knowing_(film),2009,Sun
James Wesley Rawles  An apocalyptic survivalist novel about a total socioeconomic collapse,Novel,Patriots A Novel of Survival in the Coming Collapse,/wiki/Patriots:_A_Novel_of_Survival_in_the_Coming_Collapse,2009,Social Collapse
A French film Depicts the story of a man Robinson who travels across France and Spain during the end of the world,Film,Les derniers jours du monde,/wiki/Les_derniers_jours_du_monde,2009,Unspecified
A film based upon the novel The Road by Cormac McCarthy,Film,The Road,/wiki/The_Road_(2009_film),2009,Unspecified
An album by Jon Boden,Other,Songs From The Floodplain,,2009,Unspecified
,Novel,One Second After,/wiki/One_Second_After,2009,Technology
Series written and drawn by Jeff Lemire and published by Vertigo Comics about a young hybrid humandeer who has survived an apocalyptic plague,Comic,Sweet Tooth,/wiki/Sweet_Tooth_(Vertigo),2009 to present,Disease
Remake of the 80s Television Series,Television,V,/wiki/V_(science_fiction),2009,Aliens
Reality television style drama about a group of survivors forced to live in a warehouse in the virus ravaged city of Los Angeles California,Television,The Colony,/wiki/The_Colony_(2009_TV_series),20092010,Disease
Game A postapocalyptic massively multiplayer online roleplaying game from Icarus Studios and Fallen Earth LLC set in the 22nd Century after the Shiva Virus has spread all over the world,Game,Fallen Earth,/wiki/Fallen_Earth,2009present,War
